module,submodule,question,option_a,option_b,option_c,option_d,correct,explanation,difficulty,tags
Airframe,Structures,"Which aluminum alloy is commonly used when high strength and good fatigue resistance are required for aircraft skins?",2024-T3,6061-T6,7075-T6,2024-O,a,"2024-T3 balances strength and workability, making it ideal for stressed skin panels.",medium,airframe;materials
Electrical,DC Power,"What is the first action when troubleshooting a tripped circuit breaker during a ramp check?",Reset it immediately,Log the event and continue,Inspect for cooling and reset once,Cool down then investigate the downstream load,d,"Let the load cool, then inspect it; resetting without finding the fault risks further damage.",easy,electrical;maintenance
Powerplant,Turbines,"How is turbine blade creep most effectively limited?",By reducing compressor bleed,Through controlled cooling and temperature monitoring,By enriching the fuel/air mixture,Using variable stator vanes,b,"Monitoring turbine inlet temperature and active blade cooling slows the creep process.",hard,turbine;engine-health
Human Factors,Crew Resource Management,"Which statement best reflects an assertive safety culture?",Junior technicians remain silent to keep workflow smooth,Only supervisors raise safety concerns,Everyone challenges anomalies respectfully regardless of rank,Safety notes are shared monthly,c,"Healthy CRM invites every team member to speak up immediately when something looks off.",medium,hf;crm;safety
Avionics,Navigation,"What is the role of an IRS in modern transport aircraft?",Provide HF communication backup,Deliver autonomous position and attitude data,Act as the primary weather radar,Control bleed-air distribution,b,"An Inertial Reference System calculates precise attitude and position without ground aids.",medium,avionics;navigation
